{
  "$schema": "../schemas/theme.schema.json",
  "name": "Wiki",
  "order": 1,
  "fonts": { "body": "sans", "heading": "sans", "ui": "sans" },
  "vars": { "radius": "8px", "radiusSmall": "4px" },
  "light": {
    "bg": "#f3f4f7",
    "surface": "#ffffff",
    "panel": "#eceef3",
    "fg": "#1c1e24",
    "muted": "#5d6472",
    "border": "#d8dbe2",
    "accent": "#6646d4",
    "accentFg": "#ffffff",
    "link": "#5236c0",
    "linkBroken": "#c0392b",
    "codeBg": "#eef0f5",
    "mark": "#ffe48a",
    "slotBg": "#8b8b8b",
    "slotLight": "#ffffff",
    "slotDark": "#373737",
    "guiBg": "#c6c6c6",
    "guiLight": "#ffffff",
    "guiDark": "#555555",
    "guiFg": "#3f3f3f",
    "tooltipBg": "rgba(16, 0, 16, 0.94)",
    "tooltipBorder": "#5000ff",
    "tooltipBorder2": "#28007f",
    "note": "#2f6fdf",
    "tip": "#15803d",
    "warning": "#b45309",
    "danger": "#c62828"
  },
  "dark": {
    "bg": "#121318",
    "surface": "#1a1c22",
    "panel": "#15161b",
    "fg": "#e3e5ea",
    "muted": "#9aa1ad",
    "border": "#2b2e37",
    "accent": "#9d80ff",
    "accentFg": "#130c26",
    "link": "#b3a0ff",
    "linkBroken": "#ff7b72",
    "codeBg": "#23252d",
    "mark": "#5e4f10",
    "slotBg": "#2b2d34",
    "slotLight": "#40434d",
    "slotDark": "#0d0e11",
    "guiBg": "#3a3c44",
    "guiLight": "#5a5d68",
    "guiDark": "#16171b",
    "guiFg": "#e3e5ea",
    "tooltipBg": "rgba(16, 0, 16, 0.94)",
    "tooltipBorder": "#5000ff",
    "tooltipBorder2": "#28007f",
    "note": "#6aa1ff",
    "tip": "#4ade80",
    "warning": "#fbbf24",
    "danger": "#f87171"
  }
}
