{
  "$schema": "../schemas/theme.schema.json",
  "name": "Soulrend",
  "order": 0,
  "fonts": { "body": "serif", "heading": "minecraft", "ui": "sans" },
  "vars": { "radius": "4px", "radiusSmall": "2px" },
  "light": {
    "bg": "#e8dfcb",
    "surface": "#f7f1e3",
    "panel": "#ddd2b7",
    "fg": "#2a2118",
    "muted": "#6b5c48",
    "border": "#c8b791",
    "accent": "#0f766e",
    "accentFg": "#f7f1e3",
    "link": "#0b6a63",
    "linkBroken": "#a3261b",
    "codeBg": "#ece3cf",
    "mark": "#9de3da",
    "slotBg": "#8b8b8b",
    "slotLight": "#ffffff",
    "slotDark": "#373737",
    "guiBg": "#c6c6c6",
    "guiLight": "#ffffff",
    "guiDark": "#555555",
    "guiFg": "#3f3f3f",
    "tooltipBg": "rgba(16, 0, 16, 0.94)",
    "tooltipBorder": "#5000ff",
    "tooltipBorder2": "#28007f",
    "note": "#1d5fa8",
    "tip": "#0f766e",
    "warning": "#9a5b00",
    "danger": "#a3261b"
  },
  "dark": {
    "bg": "#0c0a0f",
    "surface": "#141118",
    "panel": "#0f0c12",
    "fg": "#e9e2d2",
    "muted": "#a0968a",
    "border": "#2c2531",
    "accent": "#4fd1c5",
    "accentFg": "#04110f",
    "link": "#6fe3d6",
    "linkBroken": "#ff7b72",
    "codeBg": "#1d1923",
    "mark": "#2f5e59",
    "slotBg": "#231e29",
    "slotLight": "#3a3242",
    "slotDark": "#070608",
    "guiBg": "#1d1923",
    "guiLight": "#3a3242",
    "guiDark": "#050406",
    "guiFg": "#e9e2d2",
    "tooltipBg": "rgba(16, 0, 16, 0.94)",
    "tooltipBorder": "#5000ff",
    "tooltipBorder2": "#28007f",
    "note": "#7cb4ff",
    "tip": "#4fd1c5",
    "warning": "#f0b44c",
    "danger": "#ff7b72"
  }
}
