{
  "$schema": "../schemas/theme.schema.json",
  "name": "Minecraft",
  "order": 2,
  "fonts": { "body": "minecraft", "heading": "minecraft", "ui": "minecraft" },
  "vars": { "radius": "0", "radiusSmall": "0" },
  "light": {
    "bg": "#7d7d7d",
    "surface": "#c6c6c6",
    "panel": "#c6c6c6",
    "fg": "#262626",
    "muted": "#4a4a4a",
    "border": "#000000",
    "accent": "#3a7a2a",
    "accentFg": "#ffffff",
    "link": "#1e2fa8",
    "linkBroken": "#aa0000",
    "codeBg": "#b0b0b0",
    "mark": "#ffff55",
    "slotBg": "#8b8b8b",
    "slotLight": "#ffffff",
    "slotDark": "#373737",
    "guiBg": "#c6c6c6",
    "guiLight": "#ffffff",
    "guiDark": "#555555",
    "guiFg": "#3f3f3f",
    "tooltipBg": "rgba(16, 0, 16, 0.94)",
    "tooltipBorder": "#5000ff",
    "tooltipBorder2": "#28007f",
    "note": "#0000aa",
    "tip": "#00aa00",
    "warning": "#aa5500",
    "danger": "#aa0000"
  },
  "dark": {
    "bg": "#151515",
    "surface": "#2d2d2d",
    "panel": "#232323",
    "fg": "#e8e8e8",
    "muted": "#aaaaaa",
    "border": "#000000",
    "accent": "#55ff55",
    "accentFg": "#0a0a0a",
    "link": "#55ffff",
    "linkBroken": "#ff5555",
    "codeBg": "#1c1c1c",
    "mark": "#5f5f00",
    "slotBg": "#1f1f1f",
    "slotLight": "#4a4a4a",
    "slotDark": "#000000",
    "guiBg": "#3a3a3a",
    "guiLight": "#5c5c5c",
    "guiDark": "#141414",
    "guiFg": "#e8e8e8",
    "tooltipBg": "rgba(16, 0, 16, 0.94)",
    "tooltipBorder": "#5000ff",
    "tooltipBorder2": "#28007f",
    "note": "#5555ff",
    "tip": "#55ff55",
    "warning": "#ffaa00",
    "danger": "#ff5555"
  }
}
